{"algorithm":"Ed25519","envelope_schema_version":1,"key_id":"test-next","sequence":7,"signature":"v4doTtL1iYzMMfnhuBxf531uq3uvEOHtl/S49OonUkZvxXn9YoaCCYwYwBMNbp0UPrA20NfoIScVqf4CjJyFAQ==","signature_domain":"UAP-DIRECTORY-SNAPSHOT-ED25519-V1","snapshot_digest":"sha256:82a3c3c0528cdf846304fafccc1428ef0092cdfd47b36e1d8589fbc341ffe5de","snapshot_schema_version":1}
