{"algorithm":"Ed25519","envelope_schema_version":1,"key_id":"test-current","sequence":7,"signature":"GeQjrEatSfCjACzpPYJvWrDTXHjIPMFabG4WcRC2K4tyR9MwYk2WeBmvOcq3rSFNerFwGx72jJhUIbGwKwSTAA==","signature_domain":"UAP-DIRECTORY-SNAPSHOT-ED25519-V1","snapshot_digest":"sha256:82a3c3c0528cdf846304fafccc1428ef0092cdfd47b36e1d8589fbc341ffe5de","snapshot_schema_version":1}
